{
  "name": "Apple Wallet (Verify with Wallet / ISO 18013-5)",
  "credential_format": "MSO_MDOC",
  "issuance_protocol": "OID4VCI_PRE_AUTH",
  "supported_platforms": ["ios"],
  "is_override": false,
  "override_precedence": 50,
  "merge_strategy": "APPEND",
  "format_variant": "mso_mdoc",
  "deep_link_scheme": "mdoc",
  "created_at": "2026-01-01T00:00:00Z",
  "updated_at": "2026-07-15T14:00:00Z"
}
