{
  "name": "EUDI Reference Wallet",
  "credential_format": "SD_JWT_VC",
  "issuance_protocol": "OID4VCI_PRE_AUTH",
  "supported_platforms": ["android", "ios"],
  "is_override": false,
  "override_precedence": 50,
  "merge_strategy": "APPEND",
  "format_variant": "dc+sd-jwt",
  "deep_link_scheme": "openid-credential-offer",
  "created_at": "2026-01-01T00:00:00Z",
  "updated_at": "2026-07-15T14:00:00Z"
}
